filename,notes,authors,licenses,urls
shadow/adult/shadow.png,"","drjamgo@hotmail.com","CC0","https://opengameart.org/content/shadow-for-lpc-sprite"
body/bodies/pregnant/light.png,"see details at https://opengameart.org/content/lpc-character-bases; Pregnant Revised Run/Combat Idle/Emotes by JaidynReiman (based on ElizaWy's LPC Revised)","bluecarrot16,JaidynReiman,Evert,TheraHedwig,MuffinElZangano,Durrani,Benjamin K. Smith (BenCreating),Pierre Vigier (pvigier),Eliza Wyatt (ElizaWy),Matthew Krohn (makrohn),Johannes Sjölund (wulax),Stephen Challener (Redshrike)","CC-BY-SA 3.0,GPL 3.0","https://opengameart.org/content/liberated-pixel-cup-lpc-base-assets-sprites-map-tiles,https://opengameart.org/content/lpc-medieval-fantasy-character-sprites,https://opengameart.org/content/lpc-ladies,https://opengameart.org/content/lpc-pregnancy-bases-maternity-wear,https://opengameart.org/content/lpc-7-womens-shirts,https://opengameart.org/content/lpc-jump-expanded,https://gitlab.com/vagabondgame/lpc-characters,https://opengameart.org/content/lpc-jump-expanded,https://opengameart.org/content/lpc-male-jumping-animation-by-durrani,https://opengameart.org/content/lpc-runcycle-and-diagonal-walkcycle"
head/heads/human/male/light.png,"original head by Redshrike, tweaks by BenCreating, modular version by bluecarrot16","bluecarrot16,Benjamin K. Smith (BenCreating),Stephen Challener (Redshrike)","OGA-BY 3.0,CC-BY-SA 3.0,GPL 3.0","https://opengameart.org/content/liberated-pixel-cup-lpc-base-assets-sprites-map-tiles,https://opengameart.org/content/lpc-character-bases"
hair/long_messy2/adult/black.png,"(shura)","Yamilian,bluecarrot16","CC-BY-SA 3.0,GPL 3.0","https://opengameart.org/content/lpc-heroine-2,https://opengameart.org/content/lpc-hair"
torso/clothes/longsleeve/longsleeve/pregnant/bluegray.png,"original by ElizaWy, edited to pregnant v3 bases by bluecarrot16","bluecarrot16,ElizaWy,Stephen Challener (Redshrike),Johannes Sjölund (wulax)","CC-BY-SA 3.0,GPL 3.0","https://opengameart.org/content/lpc-7-womens-shirts,http://opengameart.org/content/lpc-clothing-updates,https://opengameart.org/content/lpc-revised-character-basics,https://github.com/ElizaWy/LPC/tree/main/Characters/Clothing,https://opengameart.org/content/lpc-expanded-sit-run-jump-more,https://opengameart.org/content/lpc-expanded-simple-shirts"
legs/pants/thin/sky.png,"original male pants by wulax, edited for female by Joe White, recolors and edits to v3 base by bluecarrot16, teen legs by ElizaWy derived from base, climb/jump/run/sit/emotes/revised combat by JaidynReiman based on ElizaWy's LPC Revised","bluecarrot16,JaidynReiman,ElizaWy,Joe White,Matthew Krohn (makrohn),Johannes Sjölund (wulax),Stephen Challener (Redshrike)","OGA-BY 3.0,GPL 3.0,CC-BY-SA 3.0","https://opengameart.org/content/liberated-pixel-cup-lpc-base-assets-sprites-map-tiles,https://opengameart.org/content/lpc-medieval-fantasy-character-sprites,http://opengameart.org/content/lpc-clothing-updates,https://opengameart.org/content/lpc-expanded-pants"
feet/sandals/thin/yellow.png,"edited for v3 bases by bluecarrot16, Jump/Sit/Emote/Run/Revised Combat by JaidynReiman","Nila122,JaidynReiman,Matthew Krohn (makrohn),Johannes Sjölund (wulax)","OGA-BY 3.0,CC-BY-SA 3.0,GPL 2.0,GPL 3.0","https://opengameart.org/content/lpc-roman-armor,http://opengameart.org/content/lpc-clothing-updates,https://opengameart.org/content/lpc-expanded-socks-shoes"
